{
  "jep": "1",
  "verb": "J",
  "who": "did:example:binding-01-test-actor",
  "when": 1785772800,
  "what": {
    "claim": "tsto_judgment",
    "decision": "accept",
    "reason": "The target and verification policy are accepted for this pilot."
  },
  "nonce": "10000000-0000-4000-8000-000000000001",
  "aud": "https://pilot.example.net",
  "ref": {
    "type": "TargetStateTransition",
    "value": {
      "kind": "external_object",
      "type": "TargetStateTransition",
      "spec": "TSTO/00",
      "id": "urn:uuid:01987654-3210-7abc-8def-0123456789ab",
      "digest": "sha-256:AXoV963URAQyGjQZ6FTjVf61N1OOTNMedtvNSfPoMG8"
    }
  },
  "ext": {
    "jep-tsto.binding": {
      "id": "https://raw.githubusercontent.com/cognitive-emergence/tsto-spec/main/schemas/jep-tsto-binding-01.schema.json"
    }
  },
  "sig": "eyJhbGciOiJFZDI1NTE5Iiwia2lkIjoidXJuOmV4YW1wbGU6YmluZGluZy0wMTpURVNULUtFWS1ETy1OT1QtVFJVU1QifQ..G-ARc1t9rkt20k9wBV-C78ZVLVY3BFC8WCPp4BXi03DEPKQe-MHcoeGcjXj_wGq6ZHZdO4rEwd_f0tXVFsosDQ"
}
