{
  "jep": "1",
  "verb": "J",
  "who": "did:example:merchant-001",
  "when": 1785772800,
  "what": {
    "claim": "tsto_judgment",
    "decision": "accept",
    "reason": "The target and verification policy are accepted for this pilot."
  },
  "nonce": "01987654-3210-7abc-8def-200000000001",
  "aud": "https://pilot.example.net",
  "ref": {
    "kind": "external_object",
    "type": "TargetStateTransition",
    "spec": "TSTO/00",
    "id": "urn:uuid:01987654-3210-7abc-8def-0123456789ab",
    "digest": "sha-256:AXoV963URAQyGjQZ6FTjVf61N1OOTNMedtvNSfPoMG8"
  },
  "sig": "UNSIGNED-EXAMPLE-NOT-A-TEST-VECTOR"
}
