{
  "jep": "1",
  "verb": "V",
  "who": "did:example:binding-01-test-actor",
  "when": 1786982400,
  "what": {
    "claim": "tsto_verification",
    "verification_scope": [
      "external_evidence",
      "factual_claim",
      "policy_compliance"
    ],
    "result": "SATISFIED",
    "policy_ref": {
      "id": "urn:tsto:verification:ar.invoice-settlement:v1",
      "digest": "sha-256:CCCCCCCCCCCCCCCCCCCCCCCCCCCCCCCCCCCCCCCCCCC"
    },
    "evidence": [
      {
        "id": "urn:uuid:01987654-3210-7abc-8def-300000000001",
        "kind": "bank_settlement_receipt",
        "digest": "sha-256:EEEEEEEEEEEEEEEEEEEEEEEEEEEEEEEEEEEEEEEEEEE",
        "observed_at": "2026-08-15T18:20:00Z",
        "media_type": "application/json",
        "location": "https://evidence.example.net/receipts/300000000001"
      }
    ],
    "observed_at": "2026-08-15T18:20:00Z",
    "reason": "The required ledger and bank evidence satisfy the selected policy."
  },
  "nonce": "10000000-0000-4000-8000-000000000004",
  "aud": "https://pilot.example.net",
  "ref": {
    "type": "TargetStateTransition",
    "value": {
      "kind": "external_object",
      "type": "TargetStateTransition",
      "spec": "TSTO/00",
      "id": "urn:uuid:01987654-3210-7abc-8def-0123456789ab",
      "digest": "sha-256:AXoV963URAQyGjQZ6FTjVf61N1OOTNMedtvNSfPoMG8"
    }
  },
  "ext": {
    "jep-tsto.binding": {
      "id": "https://raw.githubusercontent.com/cognitive-emergence/tsto-spec/main/schemas/jep-tsto-binding-01.schema.json"
    }
  },
  "sig": "eyJhbGciOiJFZDI1NTE5Iiwia2lkIjoidXJuOmV4YW1wbGU6YmluZGluZy0wMTpURVNULUtFWS1ETy1OT1QtVFJVU1QifQ..HLsdtup1w1XiPwOCui-kTxfDf7kbol3VudIzntvogRmKn4mTXnqMrfiUKtmhjCV_5my_h-kSIpO0xQ6hNF7-CA"
}
